danmaku_id,content,progress,ctime,user_hash
1972073757984015360,量子计算机那还用模拟吗？量子计算机本质就是用宇宙来计算,214.911,1762180711,97ef08d7
1972074943302720512,现在的游戏都能产生真随机数了,163.877,1762180852,95dd6e4
1972076420335607296,NPC的想象难道不是我们认为他们的想象吗？,169.145,1762181028,e3e05311
1972082159208813312,不完备性定理还在发力,92.869,1762181713,f58e636b
1972083362412079104,啊？这笔记本就只是起个显示器作用吗？,322.479,1762181856,115121a3
1972083572404251136,人类是上一个宇宙的遗民,252.037,1762181881,54598166
1972084436380419840,字幕不会动吗？,127.397,1762181984,899a6e37
1972090954891081728,只需要模拟人类探究的那部分就好了，不观察就不发生函数坍塌,95.419,1762182761,4a5a4367
1972101300208836352,这是什么游戏？,155.144,1762183994,eba35e87
1972123376600807936,阿特拉斯说是,21.169,1762186626,f8fdf6a8
1972125632087662080,撑爆算力！！！！！！！,38.07,1762186895,a8cf47a5
1972129058842381056,不用模拟整个宇宙，只是模拟地球,319.137,1762187304,97efc269
1972133512127478016,给我加强一下，谢谢,33.222,1762187834,c560473e
1972137842528955136,如果只是我们的宇宙遵循量子力学呢？,84.626,1762188351,50170ad
1972149658403255040,模拟世界的信息需要用上一层的物理结构和状态来存储和计算,46.248,1762189759,2923db1
1972150330934790400,而宇宙的物质与能量总值都是有限的，那么，每一层模拟都会发生信息缺损或者说劣化,46.559,1762189839,2923db1
1972151734558595584,模拟相比上一层世界，要么规模/信息量更小，要么运行更慢，这取决于计算机所占宇宙整体的比例,47.921,1762190007,2923db1
1972152523968647680,难道这个掉头发也是模拟的？,67.784,1762190101,bbad11ab
1972158805030912256,这就是所谓的自指悖论了，事实上，在我们宇宙模拟另一个宇宙就存在这样的悖论,142.163,1762190850,fd714042
1972162014881742592,一个代码以自己的理解代码的方式证明自己不是代码？,210.921,1762191232,bf1f59df
1972197710539320064,问题在于，一张1060足够绘制整个宇宙在这一秒的运行，只是需要的时间有四五十个零，还是拿显卡举例，比如说用十年时间逐行逐帧绘制，但是实际上只模拟了一秒钟的物理帧,181.493,1762195487,81e89c49
1972206540043697152,暗能量：没事 我会出手,27.371,1762196540,4796cc24
1972265001863814144,宇宙本身的出现对于我们这种生物都有点超理解了,134.672,1762203509,b9434372
1972279775150764032,超验,117.954,1762205270,ff7c33db
1972313358523211264,Under World是吧,160.075,1762209274,c5fd6e8a
1972314253445310720,地球ol，,52.457,1762209380,c5fd6e8a
1972336747648101888,是当前无法有效模拟,209.513,1762212062,1a8cf615
1972347511633025536,又不一定要模拟整个宇宙，甚至粒子不观测时都不用精细化加载,92.199,1762213345,d66a2798
1972354418997958144,《无法想象》,13.113,1762214169,2eea2964
1972393255996079872,最有意思的点在于，无论是否是被模拟的，我们自己以为是真实的，这就可以了,169.809,1762218798,3b2196d5
1972393282042640640,没错黑洞视界就是宇宙边界。,280.925,1762218801,328d5d00
1972395654601276160,洞穴寓言,161.031,1762219084,bd156900
1972400562825907200,很可能就是代码,208.847,1762219669,8a890c06
1972404738087603200,原来是说证明语言一直都不会拥有完善的，能解释所有现实存在的事物的性能。,134.878,1762220167,59a9db28
1972413067657134592,真实永远会穿透一切帷幕,256.547,1762221160,a80becab
1972425276705722368,以现在的科技为基础？,109.055,1762222615,ab301bee
1972443632833499904,多维思维,294.534,1762224804,e3994fe6
1972458773407169792,宇宙能够存在悖论和矛盾，本身就证明了某种超越性,136.22,1762226609,c9cb581b
1972463136121004288,比如我们的语言都有对应和起源，但语言本身一定有无法用语言解释的地方,138.484,1762227129,c9cb581b
1972464301399174656,看起来是文字游戏，但语言不能解释语言本身就已经证明了一定会有无法解释的东西,141.516,1762227268,c9cb581b
1972466116014636544,应该说是无法追溯到程序到底是怎么运行的，程序本身无法理解程序是如何运行的,153.838,1762227484,c9cb581b
1972485040621714688,你这说法漏洞太大了，你是基于目前人类科技的模拟情况，万一高等文明用的量子质子电子啥的计算方式？生物意识容器？或者我们无法理解的计算方式？,102.342,1762229740,e0615d9
1972487948298108672,完备的比不完备的更难实现,141.611,1762230086,de991fa6
1972488264649298688,凡所有相皆虚幻,239.9,1762230124,d8321b22
1972490438363663872,如来,242.175,1762230383,4453c7f1
1972493002794486528,skybox,283.978,1762230689,7d95653d
1972500427568136704,警觉,337.549,1762231574,cea62e22
1972505760550840064,虫子会意识它自己是虫子吗？,60.93,1762232210,af51bfb5
1972507042220666624,我觉得宇宙的包容性远不止如此。只是很多东西我们看不到，或者宇宙不想让我们看到。,242.59,1762232363,a169b19e
1972508530838074880,刘慈欣《镜子》,20.249,1762232540,c1bb899e
1972513943343920128,人比作蚂蚁，地球比作宇宙,14.58,1762233185,60811560
1972515221801353728,我就是NPC,158.883,1762233338,60811560
1972527645900152064,热力学第二定律,87.819,1762234819,d5b22d5c
1972537857822624768,来测！,6.796,1762236036,24827c36
1972552495222127616,数学的基本假设在宇宙中并不一定成立  以数学来论证宇宙就很搞,122.278,1762237781,b19e02f4
1972566443505608448,蚂蚁的知识，怎么去认知人类的科技？,177.617,1762239444,a833f5b9
1972567800070023168,我母校,300.366,1762239606,80453304
1972651472340433408,大成若缺，其用不弊,126.707,1762249580,6b962f61
1972658749256822528,你知道模拟这个宇宙用的是不是“代码”？,154.26,1762250448,80bbde8c
1972705681983864832,你無法想象你沒見過的事物,168.393,1762256042,b0fb59e4
1972712274087535360,我們連夢都無法區分真假，誰又能保證，醒著的我們不是在另一個巨大的夢里呢,342.786,1762256828,b0fb59e4
1972722815539608576,DP？,319.071,1762258085,2d79c623
1972723156049766144,那就不区分了,344.375,1762258125,2d79c623
1972765505802475520,完了被困在里面了、,181.653,1762263174,80f2f000
1972770453982697728,这并不影响模拟吧,116.679,1762263764,139f6bc7
1972771127629905920,不完备怎么了？数学公理体系不完备并不意味着基于这套数学建立的模拟程序不能运行,128.511,1762263844,139f6bc7
1972775114827794688,不一定,328.922,1762264319,c89ec1cd
1972824420187671296,铁墓竟是我自己,22.849,1762270197,a117ce9b
1972850742155486720,那那个计算机只是一个代名词呢？谁说一定是计算机的形态呢？,136.221,1762273335,a57e9de9
1972930634578056448,宇宙有思维有意识，所以诞生了生命,254.067,1762282859,bf55cf92
1972931176818013696,宇宙的边缘是超自然,295.579,1762282923,bf55cf92
1972987153713756416,这些东西黑格尔不早说了么,134.037,1762289596,31302ae9
1973026484348024576,有部小说叫道诡异仙 它里面的世界观就是这个,275.615,1762294285,1065aaf1
1973042473236910336,都无限了指数增长也没用啊,80.258,1762296191,a813ffe5
1973077534832794112,Yes Sir！！,169.86,1762300371,ea389cbc
1973112720472195840,黑客帝国,120.581,1762304565,f1fbbe83
1973201683899564544,等你模拟出来再说，到时候自会有解,342.112,1762315170,1c8c3d81
1973207939720597760,[]?7\,229.703,1762315916,b89a3333
1973222584955396096,就是说我们可以创造算法去模拟，意味着我们本身不能是算法创造的？,162.877,1762317662,f17e5f02
1973242014170982400,量子计算机可以,77.686,1762319978,a4cdcd37
1973246676684611840,世界底层逻辑，小子,74.427,1762320534,f8788101
1973252943042287616,虚拟机套娃了,49.116,1762321281,60a4bbe1
1973255165662380800,建议先解释为什么原子都是绝对正圆,121.866,1762321546,3fbe77c5
1973345735735149824,就哥德尔第一和第二不完备性,74.11,1762332343,ccf80a02
1973357581263592448,并非无法想象,12.725,1762333755,ab2fc150
1973373250998775552,人类无法想象认知以外的事物和代码无法理解程序以外具有共通性,250.664,1762335623,18059d4b
1973396275814487808,一个虚无常量时间就让基础地动山摇了,58.297,1762338368,5f66ed64
1973399391906084864,如果我们是代码，我希望我这一生的经历可以保留，也希望这台《计算机》对我好一点,194.12,1762338739,b4515471
1973453849725915648,这不是野心吧，对未知探索是人类优势啊,56.261,1762345231,f9b4fc7f
1973460619818651904,省流：并不是不可模拟，只不过不能以人类可理解的方式模拟,229.139,1762346038,c2662e7e
1973509336550535936,一看几千亿万T的内存条的这款游戏 我陷入了沉思,26.386,1762351845,e3eafa7
1973510132470130176,那台电脑的跑分也相当之离谱了是个天文数字,88.508,1762351940,e3eafa7
1973512431351354368,就像体里的细胞似的包里边还有细胞都说不准到底是什么,240.339,1762352214,e3eafa7
1973513382183336448,那造这个环境的艺术家也太会玩了最完美的神作没有之一了,329.212,1762352328,e3eafa7
1973529442962091264,因为弦还没能测到,117.985,1762354242,bd77f5f3
1973531510451630080,补兑,318.404,1762354489,bd77f5f3
1973583619369240832,省流：物理学中的全息术应用杂志,0.0,1762360701,92b206fd
1973604870322187520,爱因斯坦的大一统理论不可能了。。。宇宙本身就是运动的，上帝就是在抛硬币但是上帝不存在了,121.326,1762363234,ce5eca6f
1973607430340827904,问题是如果是模拟信号的计算机呢,76.495,1762363539,f5c74995
1973772494112999168,主要是人体各器官、各种基因、各种细胞，运行的太完美了，太像设计的,56.122,1762383216,ff817f6f
1973895833460641280,宇宙的本源就是无，无中生有，规则都是自定义而已：P,187.184,1762397919,f24d5291
1973935365941871616,有没有有一种可能，那是一种我们无法理解的电脑,224.298,1762402632,7645cd5d
1973937629020577280,这也被思考到了 所以也不是这个,244.436,1762402902,305e1119
1973941822133262080,当年没发明计算机的时候，都觉得算不了东西太神奇了,102.262,1762403402,8a6ad33c
1973942392910775296,对啊，我们也理解不了法则的存在,170.217,1762403470,8a6ad33c
1973977058413500160,在这之前 我们为什么要区分呢,344.27,1762407602,f198a5cd
1974017840898195200,不是自指,102.817,1762412464,649aa6bd
1974626859996568576,存在本身就是真实，差别只是不同东西,256.614,1762485065,5b768c22
1974734594662046208,DNA是不是代码表现,116.917,1762497908,bb768898
1974956888278479104,“请问你是AI生成的吗？”,1.13,1762524407,befea8c2
1975253709768439808,他们会拥有意识吗？,32.306,1762559791,201ad795
1975415737124150272,false或true,49.188,1762579106,54b7c05f
1975418221209166080,变成动态链接了,321.947,1762579402,54b7c05f
1975621725593584384,其实这应该是条件概率，就是说你第1个假设是成立的,56.78,1762603662,bcf0ca2d
1975658361211083520,真成黑客帝国了,52.773,1762608029,bb5059dc
1975666640062591488,生物系统的运算极限是没开发的，如果以特定物质例如生物的星球作为运算呢？,95.002,1762609016,27e26ee2
1975945782754972160,我去不早说,0.391,1762642292,fcd68cb8
1975973035488159488,错了这里是200亿公里拍的地球,170.221,1762645541,b2fad52
1976127739992490496,那如果数学也是被模拟出来的呢？,67.03,1762663983,9124a705
1976323477380721152,刘慈欣《思考者》，恒星是神经网络的节点,238.231,1762687317,c55fed40
1976323928469713152,但是这些都是模拟宇宙的一个部分，不是整体,336.933,1762687371,c55fed40
1976394114626959616,皇帝算数用金算盘是吧？,96.171,1762695738,a0901d38
1976495407060164864,遇事不决，量子力学,215.134,1762707813,4445c10
1976797610555578880,不是量子，是维度,247.326,1762743838,a2fd9a83
1976847016538191360,是的，模拟为了预测,335.26,1762749728,f1f06e4a
1977170824557476352,是不是真实的有意义吗？,198.874,1762788329,51620f19
1977254402750433792,宇宙就是关区。,128.574,1762798292,944151e2
1977579588473566720,手动演化,342.562,1762837057,4dd2d219
1978389361766546176,小到可以忽略,49.098,1762933590,4f3ffc97
1980550217158387712,既然宇宙可能是更高一级的文明模拟的，那你怎么证明这个基态宇宙一定不是另一个高位文明模拟的呢？就像一个(0，1)的集合，你说0.01很小，但是0.001比它更小，而0.001也并不是这个集合中最小的元素,61.02,1763191184,347723cb
1980669333487732224,人类无法想象自己认知以外的东西,177.64,1763205384,83943b9d
1980776692872470272,你真的理解了吗,149.019,1763218182,bcca9084
1981186192477250560,把这玩意当成科幻小说算了,60.386,1763266998,d2a39823
1981351807792100864,神话之外,163.471,1763286741,3ce2e7b7
1981353194991067392,666模拟宇宙,313.757,1763286906,3ce2e7b7
1982479618036660736,对,278.291,1763421186,b1773272
1983086764587845632,宇宙的运行只有你眼前的,103.009,1763493564,1c57ffd5
1983304167309492736,算不上，你说是能量，我还觉得可以,19.338,1763519480,9b5aa2cb
1983304481395920640,意识是意识，能量是能量不一样的,36.296,1763519518,9b5aa2cb
1983467006086832896,我希望是代码 否则活着到底是啥,201.5,1763538892,93b1cae8
1983557923086889728,模拟是为了避免关机好吗,337.681,1763549730,9a9144ea
1984048701190498560,说点不知道的,208.935,1763608236,f194b3ee
1984142616236800000,就像古人深信的天圆地方，现代人的理论在未来也必定会被推翻,225.393,1763619431,c253a352
1984329030643525376,为什么必须用显卡,110.227,1763641653,6bfe7442
1985186157293580288,只能说明按照宇宙内部的数学和物理规则无法模拟宇宙本身，但宇宙本身产生的规则有可能与我们认知的数学物理规则完全不同,153.86,1763743831,bd45fead
1986336413021126400,我做一个选择都得模拟一个新的宇宙，无限大容量都给你撑爆,54.352,1763880952,91d7b924
1987357329380976384,直接考虑量子电脑啊，谁让你考虑经典计算机的？,85.893,1764002655,95b20aca
1987653156829886720,我来测测！,307.388,1764037920,c6f376cb
1988979702836599296,该睡觉了,7.866,1764196057,81030619
1989392750445262336,其实量子计算也不行，宇宙太大了，即便只是区域加载，最后计算量也会指数级上升,240.5,1764245296,96165d57
1990882781991226368,黄字，代码就是我们主观定义的东西，我们理解的代码就是代码本身了，不符合我们定义的就不是,216.192,1764422922,65bf5e53
1991312827990188544,无人深空啊,42.128,1764474187,737f66a2
1991522303938199296,蚂蚁：任何高等文明都不可能培育出我们蚁类文明,328.32,1764499158,4c3b3091
1993464216551906048,回收站呗,269.999,1764730652,f6da35a8
1995973977478821120,黑洞内部？,271.434,1765029839,e176420c
1996510255056091136,记忆体,38.829,1765093769,d4d6e016
2000008130712570880,今日方知我是我,0.59,1765510748,e8be8e6e
2000321698314618880,先把人体研究明白宇宙自然懂,282.897,1765548128,c22878be
2002920962878340352,把宇宙当作自己模拟自己的计算机，真实和虚假就没区别了，它是自己诞生外面也没有高等生物在操控,226.766,1765857985,1567df09
2003693085749889280,人类以外的世界运算需求大幅降低，有无可能,226.11,1765950029,b1c000ee
2015334107126557952,那你怎么知道银河系外不是贴图？,141.778,1767337747,abc64cf4
2025308656404910336,这只能论证我们不是由同等级别的文明模拟出来的,141.164,1768526806,fb714d0f
2026738803548573184,黑客帝国,28.08,1768697292,bc40eb16
2028273238144120576,自身无法模拟自身，但可以模拟压缩后的自身,148.582,1768880211,e5083ab1
2028274162577190912,系统内极限只是系统外定义的阈值,201.233,1768880321,e5083ab1
2029287063740150016,数据都不够，怎么模拟宇宙,308.712,1769001069,f16e0db7
2036521144710095616,总得给自己设一个造物主，不然没安全感是吧,216.236,1769863438,d8027937
2036678907272468736,虚拟所见的真实就是真实，真实所见的真实也是真实，因为如果二者一模一样，那么那哪个是真哪个是伪便无法验证,329.276,1769882245,a6699ea2
2046954362672124928,宇宙其实是一切概念的总和,229.888,1771107175,b944d151
2051403190200800000,准确说，是不可被经典计算机模拟,8.848,1771637516,4db2a022
2058828599557412608,滑铁卢又不在加拿大，为啥加拿大会有滑铁卢大学,298.872,1772522694,9e46c859
2068062555041268480,我去不早说,0.6,1773623467,eb730043
2074989677274385408,量子的本质还是各种可能性组合的结果，宇宙是运行任何可能性的机器,229.972,1774449245,412585d8
2078296369843780096,反过来，神经网络与引力效应有关,250.472,1774843433,854b853b
2078517346725068800,量子算法也不是都那么有效的啊！x,216.252,1774869776,b986e783
2079532226928129536,我识海里的一个世界罢了,235.497,1774990759,b3681b6a
2080112340233863680,当然没法模拟全局，但依然不能证伪“模拟局部”这个情况。,236.893,1775059914,b67bbc4
2083334335461176576,用自己理解的数学，证明自己不理解的事务？？科学家也开始想象了吗？？？？？？？？,181.975,1775444006,b79a2286
,,0.0,1775601368.3488362,
lb.c,,0.0,1775601368.3488362,
,,0.0,1775601368.3488362,
1971959832173009664,那这是不是也能说明人类永远无法理解宇宙呢,194.029,1762167130,57a509d7
1971962555048305664,数学再一次拿下全场MVP,68.011,1762167455,5a729ca0
1971965398132343552,这篇论文到底在说啥 可能是 可能不是么,182.105,1762167794,8cce4d25
1971974458088935680,那模拟到最后不就是自然了吗？不去想尽办法做到又谈何理解呢？,236.166,1762168874,ddcc3d6f
1971980240406362368,我常常梦到未来,67.491,1762169563,22147557
1971981671696158208,哥们，现在科学是没办法解释自身，但是我们不是在寻找吗？如果我们是代码？会寻找吗？科学就是探索，探索到什么就说什么，而不是一开始就说宇宙是虚拟的，还有科学就是可以推翻之前的说法，因为科技再进步,163.691,1762169734,f133922
1971983850930721536,模拟计算,201.558,1762169993,cfb7768e
1972001935888914688,拉普拉斯妖是吧,25.848,1762172149,6b3d70c5
1972003982029693952,《no man sky》,8.363,1762172393,468536fe
1972009052699974400,会不会是当下算力不足,60.884,1762172998,dcc8b5ee
1972009945960925952,那还有人担心人工智能有自主意识,193.243,1762173104,77748e44
1972010349452861696,这么说的话你造出来的东西永远都不能意识到自己是个东西呗,193.243,1762173152,77748e44
1972021179053057280,NP=N,74.245,1762174443,7e026a71
1972022410694258176,这只能证明不是我们已知的代码形式而已,201.382,1762174590,79a7b7b
1972023780293903616,《镜子》,23.754,1762174753,ff8aff24
1972027210832048128,为什么一定要假设宇宙是数字计算算法？不可以是模拟计算或者量子计算？,184.115,1762175162,5ee20897
1972030482388877824,不用完美，有用就行,329.14,1762175552,f38414d0
1972030710710222080,无限大,48.945,1762175579,f696f84d
1972034091184628224,不止于模拟，而要改写和创造,344.937,1762175982,7b5734c0
1972037994319902976,那么弦论计算器又如何呢,81.742,1762176448,ec1e650d
1972042136421803776,“无限”这个定语就不现实了。,17.513,1762176942,87e48e88
1972044758566628608,你不能用相机拍摄电脑机箱通过电脑内的电脑屏幕看到被拍摄的电脑机箱以理解自身的“真理”或电脑的运行,176.637,1762177254,4d92c24b
1972046592366635264,那就要看模拟被结束的那一瞬间，你是否还认为刚刚的模拟是“模拟的”,342.469,1762177473,4d92c24b
1972058364603783936,如果真的能进行这模拟，那就不是模拟了，而是创造了一个新的宇宙,116.27,1762178876,63ca4e4e
1972066246816624640,盘古女娲神话时期，不是说了地球以及生物都不存在的吗？,61.788,1762179816,5d7838f2
1972071633225642240,宇宙在模拟自己,295.156,1762180458,c5463b3b
1972073757984015360,量子计算机那还用模拟吗？量子计算机本质就是用宇宙来计算,214.911,1762180711,97ef08d7
1972074943302720512,现在的游戏都能产生真随机数了,163.877,1762180852,95dd6e4
1972076420335607296,NPC的想象难道不是我们认为他们的想象吗？,169.145,1762181028,e3e05311
1972082159208813312,不完备性定理还在发力,92.869,1762181713,f58e636b
1972083362412079104,啊？这笔记本就只是起个显示器作用吗？,322.479,1762181856,115121a3
1972083572404251136,人类是上一个宇宙的遗民,252.037,1762181881,54598166
1972084436380419840,字幕不会动吗？,127.397,1762181984,899a6e37
1972090954891081728,只需要模拟人类探究的那部分就好了，不观察就不发生函数坍塌,95.419,1762182761,4a5a4367
1972101300208836352,这是什么游戏？,155.144,1762183994,eba35e87
1972123376600807936,阿特拉斯说是,21.169,1762186626,f8fdf6a8
1972125632087662080,撑爆算力！！！！！！！,38.07,1762186895,a8cf47a5
1972129058842381056,不用模拟整个宇宙，只是模拟地球,319.137,1762187304,97efc269
1972133512127478016,给我加强一下，谢谢,33.222,1762187834,c560473e
1972137842528955136,如果只是我们的宇宙遵循量子力学呢？,84.626,1762188351,50170ad
1972149658403255040,模拟世界的信息需要用上一层的物理结构和状态来存储和计算,46.248,1762189759,2923db1
1972150330934790400,而宇宙的物质与能量总值都是有限的，那么，每一层模拟都会发生信息缺损或者说劣化,46.559,1762189839,2923db1
1972151734558595584,模拟相比上一层世界，要么规模/信息量更小，要么运行更慢，这取决于计算机所占宇宙整体的比例,47.921,1762190007,2923db1
1972152523968647680,难道这个掉头发也是模拟的？,67.784,1762190101,bbad11ab
1972158805030912256,这就是所谓的自指悖论了，事实上，在我们宇宙模拟另一个宇宙就存在这样的悖论,142.163,1762190850,fd714042
1972162014881742592,一个代码以自己的理解代码的方式证明自己不是代码？,210.921,1762191232,bf1f59df
1972197710539320064,问题在于，一张1060足够绘制整个宇宙在这一秒的运行，只是需要的时间有四五十个零，还是拿显卡举例，比如说用十年时间逐行逐帧绘制，但是实际上只模拟了一秒钟的物理帧,181.493,1762195487,81e89c49
1972206540043697152,暗能量：没事 我会出手,27.371,1762196540,4796cc24
1972265001863814144,宇宙本身的出现对于我们这种生物都有点超理解了,134.672,1762203509,b9434372
1972279775150764032,超验,117.954,1762205270,ff7c33db
1972313358523211264,Under World是吧,160.075,1762209274,c5fd6e8a
1972314253445310720,地球ol，,52.457,1762209380,c5fd6e8a
1972336747648101888,是当前无法有效模拟,209.513,1762212062,1a8cf615
1972347511633025536,又不一定要模拟整个宇宙，甚至粒子不观测时都不用精细化加载,92.199,1762213345,d66a2798
1972354418997958144,《无法想象》,13.113,1762214169,2eea2964
1972393255996079872,最有意思的点在于，无论是否是被模拟的，我们自己以为是真实的，这就可以了,169.809,1762218798,3b2196d5
1972393282042640640,没错黑洞视界就是宇宙边界。,280.925,1762218801,328d5d00
1972395654601276160,洞穴寓言,161.031,1762219084,bd156900
1972400562825907200,很可能就是代码,208.847,1762219669,8a890c06
1972404738087603200,原来是说证明语言一直都不会拥有完善的，能解释所有现实存在的事物的性能。,134.878,1762220167,59a9db28
1972413067657134592,真实永远会穿透一切帷幕,256.547,1762221160,a80becab
1972425276705722368,以现在的科技为基础？,109.055,1762222615,ab301bee
1972443632833499904,多维思维,294.534,1762224804,e3994fe6
1972458773407169792,宇宙能够存在悖论和矛盾，本身就证明了某种超越性,136.22,1762226609,c9cb581b
1972463136121004288,比如我们的语言都有对应和起源，但语言本身一定有无法用语言解释的地方,138.484,1762227129,c9cb581b
1972464301399174656,看起来是文字游戏，但语言不能解释语言本身就已经证明了一定会有无法解释的东西,141.516,1762227268,c9cb581b
1972466116014636544,应该说是无法追溯到程序到底是怎么运行的，程序本身无法理解程序是如何运行的,153.838,1762227484,c9cb581b
1972485040621714688,你这说法漏洞太大了，你是基于目前人类科技的模拟情况，万一高等文明用的量子质子电子啥的计算方式？生物意识容器？或者我们无法理解的计算方式？,102.342,1762229740,e0615d9
1972487948298108672,完备的比不完备的更难实现,141.611,1762230086,de991fa6
1972488264649298688,凡所有相皆虚幻,239.9,1762230124,d8321b22
1972490438363663872,如来,242.175,1762230383,4453c7f1
1972493002794486528,skybox,283.978,1762230689,7d95653d
1972500427568136704,警觉,337.549,1762231574,cea62e22
1972505760550840064,虫子会意识它自己是虫子吗？,60.93,1762232210,af51bfb5
1972507042220666624,我觉得宇宙的包容性远不止如此。只是很多东西我们看不到，或者宇宙不想让我们看到。,242.59,1762232363,a169b19e
1972508530838074880,刘慈欣《镜子》,20.249,1762232540,c1bb899e
1972513943343920128,人比作蚂蚁，地球比作宇宙,14.58,1762233185,60811560
1972515221801353728,我就是NPC,158.883,1762233338,60811560
1972527645900152064,热力学第二定律,87.819,1762234819,d5b22d5c
