danmaku_id,content,progress,ctime,user_hash
2082613555886885120,先登！！！,0.368,1775358082,e8533d35
2082613607837121280,最早的一次!,10.851,1775358088,eeb8eb3a
2082613791388398592,第一响应,8.222,1775358110,5afa6e2a
2082614471402396160,第一响应,3.931,1775358191,bab81a2e
2082615668381237504,早,1.555,1775358334,1938f7b8
2082617597794904576,！,16.777,1775358564,883c002c
2082617681479671808,！！！,21.279,1775358574,883c002c
2082618109374198016,那很坚固了,142.286,1775358625,749a6930
2082618737781586176,相当于与空气斗智斗勇,276.499,1775358700,a0a808dc
2082618941137715456,？,43.879,1775358724,2574e48a
2082620452487880448,赠予？斯柯达这些企业不都是捷克土地上成长的吗？,116.927,1775358904,3a7ff4a7
2082622807614815232,19分钟最早的一次,11.5,1775359185,423f1249
2082624981321989632,新鲜的！,14.18,1775359444,c272e1f2
2082625354933724672,大家快发弹幕！,45.2,1775359488,c272e1f2
2082626759832603136,来了,22.657,1775359656,9a3b6bfd
2082628852404165120,马奇诺（beta）,142.99,1775359905,c265ae92
2082631103512647680,德国方面大概是40到五十个师,258.961,1775360174,23093a51
2082634789584252928,太难崩了,132.165,1775360613,cd1360a8
2082640896574910464,先登,8.847,1775361341,c06a57d3
2082650183845616640,就算读过了听过这样的故事，他们依然会这么做,69.658,1775362448,e6223a98
2082651503507811328,《六国论》,49.357,1775362606,f990c581
2082660505893522688,重点马奇诺。,151.223,1775363679,ea977cc8
2082661752826676480,进入到欧洲线了,15.799,1775363827,d4285a02
2082677330916734976,苏台德防线,143.594,1775365684,3b4690b6
2082677488336975616,热乎的,1.121,1775365703,9c5d7c17
2082679100493431808,惊变28天的音乐？,30.031,1775365895,3e4dd43
2082682999694264320,德国也有“法”学家,152.193,1775366360,784209df
2082692032950026496,与空气斗智斗勇的前提是德国从来没想过入侵苏台德,281.929,1775367437,2f390b45
2082697518235918080,虎头要塞也被称为东方马奇诺,159.545,1775368091,301221e
2082704820712140544,英法美从来都是这样     冷战期间真正援助的多的也是苏联和中国,327.823,1775368962,b470a1a0
2082710580397285120,演讲天赋,197.639,1775369648,63c3bc72
2082714807157185792,外交声明也算吗，那俄国也有参与,321.16,1775370152,a7f46913
2082715718637775104,二战时期:慕尼黑的阴谋,54.285,1775370261,7015c6a1
2082719181564291072,关东军要塞：你也东方马奇诺？,142.8,1775370673,4fc4110c
2082723451315242240,先登。。。,3.562,1775371182,522058e7
2082738398547744512,奥匈战败后斯柯达这些战败国的企业相当于协约国的战利品,122.392,1775372964,fa2d6ec9
2082746513603993088,马奇诺这个名字可不吉利,157.281,1775373932,da30d27f
2082747235410187008,法国：友军有难不动如山,226.237,1775374018,da30d27f
2082757344353522432,捷克那会也不弱，真要打德国也得掂量掂量,337.684,1775375223,6a7c8c18
2082767477540530176,军力不够加政治内耗,208.196,1775376431,a4c63974
2082787188965878784,难怪不说钢4里捷克斯洛伐克边界有一圈堡垒,141.037,1775378781,29006f7d
2082789027597725440,一战太惨烈了，给当时的参战国都打怕了,333.309,1775379000,29006f7d
2082790917626705408,？,134.235,1775379225,c7b93e49
2082828689456307200,1924/1925年，兵工厂Škoda Works收购了Laurin & Klement公司，将其汽车业务纳入旗下，并改用Škoda品牌继续生产汽车,120.436,1775383728,b318b846
2082828853873287168,这就是今天我们熟悉的斯柯达汽车的直接来源,120.436,1775383747,b318b846
2082835683953231104,我带来了一个世纪的和平！（确信,5.32,1775384562,d0de5dca
2082869309034165248,不是天真，而是无奈,183.336,1775388570,ddabb81f
2082880750558499328,不一定，英法的备战水平，尤其是英国远远没有到1939年的备战水平，而且张伯伦政府的作战意愿相比丘吉尔不确定性太大,312.032,1775389934,7bb346c5
2082880870649322496,波西米亚历史上可不是小国,120.232,1775389948,13aea246
2082889488979927808,德米特里亚佐夫的大审判,7.702,1775390976,5d4ccbe6
2082895475560404480,我不明白,82.419,1775391689,2d43b1b1
2082898691643578624,筹码不足，正常规则失效,176.008,1775392073,17610fa6
2082905567533948160,但是英法怎么保住捷克斯洛伐克,57.019,1775392892,4365a315
2082919430715240960,这不是玩钢四你提前准备然后闪击德国，你得师出有名，就算你先干了德国，又有谁会帮你，经历过一站，谁又想做领头的,322.18,1775394545,f90d1105
2082921579196890880,但这些本来就是波希米亚王国的版图吧,114.255,1775394801,76022946
2082922943796904448,从没读过 过秦论,51.473,1775394964,3e94fce1
2082923311821898240,苏联跟捷克也签署了互助条约,313.864,1775395008,76022946
2082924781304728320,仇恨的因与果,44.824,1775395183,2f0829a3
2082933536335814656,喜欢这个题材 先投币支持~~~~~~~~~~~~,8.552,1775396227,fba8b10
2082933626840415744,固若金汤，指硬叠软攻或者随便造点飞机搞制空权就能打穿的防线？,140.937,1775396237,e2a4ed8e
2083009441779310336,我不明白,101.8,1775405275,ee81619d
2083047913780805888,挺难绷的，德国自己都不知道自己秘密集结了部队,270.573,1775409861,e3ae2a08
2083051233060488704,不是他们想退让 英国一战打掉了了多少人？ 民众不想参战。,40.099,1775410257,2170b0c7
2083056305174068480,叙利亚  黎巴嫩 伊朗,80.992,1775410862,898cdc4c
2083101444885911552,跨国卢比孔河,51.04,1775416243,9df853c8
2083124886632754176,和小协约国一样的功能,123.473,1775419037,5f83f733
2083222207362036736,天国拯救！,92.426,1775430639,9ee5d594
2083222540901539072,波西米亚？天国拯救！,121.876,1775430679,9ee5d594
2083337303577083136,就算他不这么做，也没有其他办法。,158.468,1775444359,d2d0bf3
2083405527840882176,小国的悲哀！,338.594,1775452492,922cbf9c
2083409086984519168,……,328.253,1775452917,7280a7ab
2083419691728209408,当时就没有国家准备好打世界大战的，包括德国，希自己都对同僚说如果英法态度强硬就见好就收,66.07,1775454181,ffa832e3
2083483687848709120,史诗狂怒！！,293.366,1775461810,23d95a69
2083517377479968256,莱茵蓝,65.823,1775465826,ae551ef7
2083531773748657152,我们换来了一个时代的和平。,11.66,1775467542,d9102ffb
2083593741872722944,买了，兄弟,169.103,1775474929,db68de72
2083601497702329088,独立性由法兰西共和国保障,135.023,1775475854,e638259e
2083709251083863808,民众不想参战不是张伯伦绥靖的根本原因，是他自己对国际形势的误判,44.634,1775488699,3b90cb7f
2083849345862226688,本次大战的导火索是美债危机,195.968,1775505400,8ec4dd92
2084031493344206848,底线具体在哪都是事后评论的，事前谁知道？乌克兰是不是底线？委内瑞拉是不是底线？只有后世知道,57.149,1775527113,241c69b6
2084112053224407808,六国论：怎么还有我的事,52.266,1775536717,14a511da
2084152094700808192,下期人物传预定,253.998,1775541490,fc1cf231
2084164573904840960,文案神了,42.58,1775542978,2835396a
2084171887319366400,至少今年不会打仗了,16.311,1775543849,c4a546f7
2084180358068418560,法国总统已经尽力了，奈何政客不去做,300.651,1775544859,19b523a7
2084216927449793536,《索取苏台德》,94.695,1775549219,14fa42cf
2084251550154919168,也算是有能力了,255.8,1775553346,332acbe9
2084311408921099776,当时法国政坛极为混乱，即使总统想做，但也奈何有心无力,304.567,1775560482,61f5316
2084320681084643328,那代价呢？,57.542,1775561587,840b25e7
2084510083127034624,以地事秦，如抱薪救火！,39.777,1775584166,522058e7
2084511497111183872,对于防线马奇诺可不是个好名字啊！,143.098,1775584334,522058e7
2084581771869092096,我去 不早说,22.364,1775592712,f70222be
,,0.0,1775601368.3488362,
lb.c,,0.0,1775601368.3488362,
,,0.0,1775601368.3488362,
2082618061710009600,认识汤米谢尔比不,392.063,1775358619,3909fece
2082618221604999936,但现实是，其中不少人在后来的大战中选择扛枪走上了战场,442.968,1775358638,b31e54c8
2082619652248804608,图中为壁画《格尔尼卡》，描述的是格尔尼卡遭轰炸时的景象,556.256,1775358809,f0272294
2082621337813762816,一战是利益战争，离谱的动因和惨烈的过程导致反战思想浪潮，这很正常嘛,447.822,1775359010,67079c30
2082623141834170624,想到这儿，张伯伦忍不住轻哼起来,614.495,1775359225,67079c30
2082625435404871424,正是这个条约，诞生了俾斯麦号战列舰。,480.492,1775359498,b7be8539
2082630481245307392,喜欢算经济账,389.773,1775360100,8de26169
2082632013810454272,捷克斯洛伐克在欧洲也算不上一个微不足道的小国吧？虽然和英法德比起来当然算小,620.633,1775360282,ba3fd5b1
2082632051030277632,法国已经担不起欧陆霸主的位置了，不然克里孟梭也不会节节退让,511.971,1775360287,8de26169
2082633251373757952,通德门,496.698,1775360430,6e52a4be
2082635198746514432,问题是当时不能弄太狠，真做了就必须做到底，慢慢放松只会招致灾难,467.334,1775360662,ca1963a1
2082637818056173056,波西米亚有海？这很狂想曲,362.195,1775360974,fa4dabae
2082642171558789888,这里的波西米亚地区包括德国和捷克的部分,375.172,1775361493,570e1e08
2082643348246240512,苏德互不侵犯协议:你好(doge),616.202,1775361633,a96bd0c1
2082644514371738368,以及商业普遍看中短期回报的局限,395.804,1775361772,c2a183b6
2082645016924903680,好战必亡，忘战必危,436.72,1775361832,c2a183b6
2082645256503644160,英国的衰弱可以去看布尔战争。,570.512,1775361861,4c1fd97b
2082646029153158400,但仇恨心理会反弹，他们会不止于要回正当权利,502.632,1775361953,c2a183b6
2082648655341060864,几十年后的波西米亚狂想曲都还在描述一个流浪的可怜虫，还有浴血黑帮的吉普赛佬，偏见早就深入骨髓了,377.466,1775362266,264e80de
2082649105968639488,商家最大的弱点永远都是亏损,392.323,1775362320,8b8e728f
2082655219854168576,特郎普：难说,412.399,1775363049,1673f5ee
2082665544645688064,英法美的如意算盘都是让德国跟苏联互相消耗，他们坐收渔翁之利,621.221,1775364279,fc6043ea
2082671848458053888,并非毫无意义，至少防止了被德军铁蹄一脚踹死,549.682,1775365031,8e54e85f
2082673286525455872,特郎普:好巧我也是商人,405.515,1775365202,1a5ec960
2082675491621928192,美国现代也是如此,567.292,1775365465,1667d0b4
2082675933945024512,不会的，白羽毛让法国男人绝望,665.566,1775365518,69a030be
2082689947693508352,不太可能，还记得一战后法国也曾为了防备德国，希望通过吞并或者莱茵兰来肢解削弱德国，但最后还是没有得到英美两国同意。,479.521,1775367189,e5f7484f
2082693125029016576,毕加索的格尔尼卡,554.689,1775367567,4e64babd
2082693888711423488,传统艺能,613.722,1775367658,4e64babd
2082695690097743360,这里指的是战火不会蔓延到本土而飞机改变了这一点,556.877,1775367873,2f390b45
2082696916050981376,成功了,616.68,1775368019,2b5d77
2082697019776340736,嚯……民族、政治、独立、尊严…哪一个可以调和？,397.918,1775368032,fdb14aca
2082697253826722304,一头小羊羔拿着一张条约让猛虎去对抗东方的巨熊,616.061,1775368059,2f390b45
2082698255116247808,这个时候法国也应该进入强人政治才对但结果是这个时候的法国政坛相当混乱,669.526,1775368179,2f390b45
2082712229404704000,祖师爷！预言家这一块,461.344,1775369845,63c3bc72
2082714843236230144,太先进了，和社会发展水平矛盾了,441.677,1775370156,2b5d77
2082714927877595136,二战时期英吉利海峡还是有屏障作用的，但是冷战时期就没什么意义了，没有中美牵制苏联，整个欧洲包括英伦三岛都会被推平,552.879,1775370166,b470a1a0
2082716261196543232,现在导弹可以覆盖全球，这意味着进行战争是要有很强的承受损失的能力的（血厚），岛屿国家在现在无力打仗,564.605,1775370325,b470a1a0
2082717149189342720,要说英国低估谁了，绝对是低估了二战法国的厌战,517.6,1775370431,a7f46913
2082730397947195904,苏联不也是希望德国跟英法先开吗？,664.044,1775372011,1823c359
2082733497805853696,没有,662.908,1775372380,4c739af2
2082733717587313152,伦敦上空的鹰,550.368,1775372406,14d08af1
2082750449815588352,体面,604.17,1775374401,da30d27f
2082755184144434944,哪怕当时是丘吉尔代替张伯伦，决策也是一样的。,631.407,1775374965,1e160b34
2082757948232460544,现在欧洲跟过去有何区别,636.452,1775375295,3ce23725
2082759526021015040,李鸿章：这我熟啊,617.038,1775375483,975c9a7c
2082760758223443968,苏联的情况和英美帝国主义完全不一样,556.555,1775375630,b4a6dfef
2082801308872105984,法國更慘⋯⋯,669.909,1775380464,4ea25cf4
2082808434206059008,妙啊,627.201,1775381313,c73c9356
2082825239054205696,站在当时英国的角度他是对的，这是必然~但正确并不意味着好结果，但历史的必然却可以被预测和证实,601.651,1775383316,3725d2ad
2082829745724791808,还真是,462.331,1775383854,7ad08d86
2082837357027735808,驱虎吞狼,622.383,1775384761,7d7b39e6
2082843903606477312,国王与国家未必等同于祖国……,441.76,1775385541,9e336acb
2082844551969805824,薪不尽火不灭,612.712,1775385619,2daaf449
2082854542458349824,因为害怕死亡所以选择放下武器，这得不到铸剑为犁式的和平,454.295,1775386810,e17c5306
2082859017201562880,贝当：我盯着呢,712.196,1775387343,53d0965e
2082868502796680192,哎，打累了,667.253,1775388474,63bf5512
2082873305778174976,如果仅从英国的角度来说：并不算错误,659.853,1775389046,ddabb81f
2082876613548881664,他低估了德国和苏联,625.982,1775389441,f0349045
2082878625900299264,张伯伦怎么想无所谓，但是你法国跟德国接壤，你都不行动吗？,631.739,1775389681,662610e4
2082880009802685440,二战英国也确实在扛好几条战线,537.952,1775389846,364e7a11
2082887283194869504,法国打空了一代人可不是说说的，人家是真不想打了,636.039,1775390713,306bda1a
2082887371108146944,相比赢了输了，赚了更重要,390.404,1775390723,be26eadc
2082892492738974976,bf109打不过喷火，反正我g10打不过大喷九,565.124,1775391334,d3f363ec
2082921069110906624,至少在二战期间，英吉利海峡在对抗德国还有巨大作用,549.901,1775394740,cabf614a
2082940025184261632,不算什么预言家，当时只要是个政客都知道凡尔赛体系活不了多久，所以法国会见马奇诺，所以苏联会搞工业化,469.056,1775397000,d052429
2082940672272949504,确实，一战那种后果，再不反战真说不过去了，只是形势发展已经不能用老眼光来看了,450.9,1775397077,dd505747
2082940703998723072,张伯伦赢了输了?赚了,396.309,1775397081,5eaaeca8
2082941898989588480,所以苏德互不侵犯条约就实现了英国梦寐以求的欧洲稳定，虽然他自己不稳定就是了,613.274,1775397223,d052429
2082950779379176192,解读不同,502.895,1775398282,85117877
2082967244732410368,驱虎吞狼,605.833,1775400245,cd9a7fa6
2082977310407408640,问题在于，英法还真有能力在像一战一样打败德国吗？美国真会起到离岸平衡的作用吗？,472.166,1775401445,cf28f639
2082981061859726080,关键是经历了 300 多年安稳的后方，已经没了主动直面战争冲突的勇气,576.141,1775401892,5177bff6
2082994523268936192,确实，没有解决任何问题反而埋下了大雷,467.088,1775403497,bf1c3e4e
2083065873597476352,是的,430.328,1775412002,580fe54
2083067935081549824,欧陆雄狮埋葬在了二十年前的那片高地,665.829,1775412248,45996f4d
2083084376392446976,前几天还辩论以色列问题了,440.806,1775414208,77de18fb
2083104997721815040,说实话当时英国佬对欧洲其实还是没有那么高的兴趣，只要别动英国的殖民地，英国很多事情都是保持冷漠态度,502.359,1775416666,b5db6d0a
2083141897203337472,抛弃法国的代价就太大了,658.593,1775421065,8d1a403d
2083225971363951360,波西米亚有剑圣亨利,363.275,1775431088,9ee5d594
2083337967535644928,将枉过正了,469.88,1775444438,4ba68137
2083346315752515328,当时德国确实很弱。,491.842,1775445434,d2d0bf3
2083383103640436736,波西米亚还穷，神圣罗马帝国最重要的钱袋子，腓特烈大帝拼命也要抢回来的地方,364.481,1775449819,dc0ddbff
2083413855002506752,法国当时的问题比很多弹幕想的都要复杂，不是一句一战打光了一代人就能解释的,710.692,1775453485,c7cf433e
2083420391673851392,二十年后的戴高乐会不会在想如果这时候的法国总统是当时的自己该有多好,675.331,1775454264,2f689182
2083452838750571776,还真是,464.68,1775458132,ccde3344
2083455783588378880,一战把法国一代人都打没了，才过没多久又要打，谁顶得住,665.36,1775458483,ccde3344
2083501486058568704,之后还支援苏联算下来扛了好几条线,545.852,1775463931,c0c5d7c0
2083510570677634048,但是为什么会受尽委屈呢,496.837,1775465014,e479419d
2083538281572047872,捷克斯洛伐克也不临海啊？,360.91,1775468318,8f8dafa6
2083558956605009408,莫斯利,495.752,1775470782,981550c1
2083565719702113280,哈哈哈,600.402,1775471589,5212282b
2083574281484478464,是你！凯恩斯经济主义的创始人！,453.893,1775472609,df9879db
2083591257535538432,日本是英国武装起来打大清的，100年后反噬了自己,599.9,1775474633,b7f4f571
2083611071360757504,英国皇家空军庇护了不列颠,549.303,1775476995,a0b78571
2083632572386734080,洲际导弹的存在使美国的两条护城河（太平洋和大西洋）也成了小河沟,552.856,1775479558,d28590d5
2083661118349913856,逻辑上没错，后来苏德也的确打起来了,628.672,1775482961,c8861eb3
2083698933918074368,一场小规模战争和孤悬海外的和平，英国选哪个都能接受，可惜张伯伦选了or,404.142,1775487469,652c2606
2083905549460066560,一战德国也死了很多人，你们知道吗,675.47,1775512100,c46a9d4
2083949678126774784,英国重商主义,409.149,1775517360,a86fbd8
2083979306388203776,苏联和美国二战前也都是英国的敌人,529.805,1775520892,d7e100b2
2084098681967748608,还真是，到英国旅游每经过一个小村子都有一战纪念碑 刻着名字的那种,425.948,1775535123,b84aace
2084110472282016768,这里可以参考另一位UP主新雨Paul的观点，参谋长分析非常到位,476.275,1775536528,7179432
2084194982835236608,确实,593.311,1775546603,1bb06874
2084239247908753664,某种意义上来说确实修正了,503.757,1775551879,2eda6b6a
2084240117589236736,历史会告诉他们谁才是致命威胁,590.076,1775551983,2eda6b6a
2084251623798639616,确实,587.005,1775553355,91a5445f
2084275095006359552,英德关系一向不错，而且英国也不希望大陆上法国一家独大,508.433,1775556153,6291455
2084288215208048384,还真是,463.069,1775557717,19911fdc
2084312115795108352,所以法国也不惯着你，直接投了,508.364,1775560566,6c4a301d
2084515578890384640,毕加索的名画,554.02,1775584821,522058e7
2084535548927770368,现在看来完全正确,592.201,1775587201,45c6e48
2084693337604025344,好赖话全说尽了,504.647,1775606011,1ef172e7
2084751251874527744,确实坐收渔翁之利了，不过是美国,616.647,1775612915,2e2a6cc4
2084827037704688640,越不想打仗越会打大仗,681.476,1775621949,c0829a5e
,,0.0,1775601368.3488362,
lb.c,,0.0,1775601368.3488362,
,,0.0,1775601368.3488362,
2082625433140315136,混乱的政府(,874.57,1775359498,a2779482
2082625595845870848,其实马奇诺防线很好地完成使命，逼着德军绕道比利时，英国必然参站，只不过这次英国也没顶住,862.298,1775359517,89221bf4
2082626920952139264,混乱的政府,880.983,1775359675,571de247
2082634368291196672,法国人出卖小协约国的行为间接导致了比利时和卢森堡放弃与法同盟，转为了中立,853.778,1775360563,9e507cdb
2082635380141918976,还有戴高乐,999.092,1775360684,6b299af3
2082635510635194112,感觉法国每次与德国开战前都要吃一个混乱的政府debuff,873.432,1775360699,ba3fd5b1
2082648929438610688,杜兰特，前辈啊,821.887,1775362299,11fc3934
2082649617145134080,一对比，曼联都算知人善任吧,887.356,1775362381,11fc3934
2082650829726949120,戴高乐那时候还在天天被贝当那群老资历打压呢,1004.182,1775362525,e355097e
2082657218364595200,因为老百姓眼里都看到了，英勇无畏的热血年轻人都死在前线了,1009.834,1775363287,1ff79f15
2082658447581220608,的确是一个政治天才,1036.073,1775363433,c21adfe6
2082658596923518208,世界大战的胜利者，混乱的政府,893.047,1775363451,4414484
2082664456240429056,一语成谶,767.352,1775364150,8b8e728f
2082664915953038592,受马奇诺防线保护：计划上限+25，计划速度-25,856.927,1775364204,c7c4183c
2082666886621640704,西班牙军事学院开课了,925.587,1775364439,c7c4183c
2082668196845856256,马奇诺的建造成本和相比维持大量军队的开销已经很小了,862.135,1775364596,60282476
2082668945915159040,戴高乐这时候不是被打压，是还没发迹的下层军官,1011.983,1775364685,c9251ba
2082692056228574976,军事学院，启动,923.248,1775367440,9e656172
2082702331359108352,这么狠吗？,932.528,1775368665,fdb14aca
2082702340317714176,为什么俄国付出了这么惨重的伤亡依然不怕战而法国不行？,996.256,1775368666,2f390b45
2082715296716176128,太抽象了,951.309,1775370210,a4198321
2082721347352150272,当时的苏联也是这个想法。让德国的疯狂陷入一战那样,825.54,1775370932,a7f46913
2082723313079807232,因为一战还是没让俄国人伤及根本，你看二战后俄国人就反战倾向特别强烈了,1005.039,1775371166,f23d3c0f
2082736399560011776,拿破仑不是意大利人吗？,984.483,1775372726,819ec8e6
2082747456483137024,查理曼大帝，路易十四，黎塞留，拿破仑，塔列朗，克里蒙梭，接下来就是戴高乐了,998.774,1775374044,fa2d6ec9
2082787810511284736,确实更可怕,909.995,1775378855,4c96ddce
2082791104608059648,因为俄国人口基数大，一战时1.7亿人，死几百万不至于打光一代人，法国不行，一战时总人口才4000万,998.68,1775379247,55f7d29a
2082803200377113088,圣康坦的伤痕,728.596,1775380689,38bf097c
2082803782815170560,西班牙內戰前夕那場法國選舉是真正的觸目驚心⋯⋯,875.536,1775380759,4ea25cf4
2082828920277434880,没有足够的意愿和能力去约束敌人，什么条约都是白搭,847.776,1775383755,3725d2ad
2082833200933081600,阶级利益就是这么牛逼,936.56,1775384266,1dfc434a
2082881963073071616,协约国刚打进德国，德国就投了,729.798,1775390079,364e7a11
2082882772288629760,成立人民阵线——复兴国民联盟,897.377,1775390175,9b821ddd
2082900027084345600,充分就业，可疑的盟友（英国），大萧条的影响，世界大战的胜利者,847.076,1775392232,fe9bb17b
2082901116337346048,说的这么准，还真是二十年,764.656,1775392362,e7d7d881
2082916458446550016,前面的，别忘了还有混乱的政府,862.331,1775394191,833b15bc
2082920141305476864,所以之前发了巴黎合会的合集为这集做背景铺垫,749.722,1775394630,e96da9f
2082927087374680832,打的太狠 出PTSD了,1006.721,1775395458,3e94fce1
2082928509201743872,政治暴力、混乱的政府,877.444,1775395627,76022946
2082929556830248960,拿破仑是科西嘉人,992.248,1775395752,76022946
2082939094425561856,放手一搏吧别顾虑太多,1035.632,1775396889,1f0371cf
2082942053734041088,花费其实没有西墙防线高,861.432,1775397242,6379e10
2082944275129582336,其实也不客观，当时军放认为对面德国有25万人，法国要进行军事动员才能战胜，说不定让法国重陷战火,920.116,1775397507,6379e10
2082953621146408960,其实一战后欧洲第一陆军已经不是法国了，是英国说的，真正的第一陆军反而是德国，第二是苏联，法国撑死排到第三,728.843,1775398621,198e0eb7
2082956302765580800,那行我点了,756.319,1775398941,27b4951a
2082964293032661504,协约国基本就没打进德国 德二投降时战线依然在法国境内,733.106,1775399893,51ccfb3d
2082981760496643072,德国弱了法国旧有欧陆霸权了，怎么可能不帮助德国呢,808.902,1775401975,f673a253
2082989808988507136,法国人误以为自己也是战胜国,761.96,1775402935,75b723f2
2082994438527163904,一战前、二战后不也都一样，说的像战间期哪特殊似的,890.073,1775403487,75b723f2
2082995863080185600,现在的频率也差不多,885.535,1775403656,22c44c23
2082998902567277824,钢丝特有的战胜国的buff,723.731,1775404019,6b66f9a4
2083028115575789056,键政up主一定要敢于下判断,1029.638,1775407501,df24cd4
2083082229034416384,跟苏联签条约真的有用吗,953.808,1775413952,2af58bce
2083109043429561344,“抵抗之弧”,775.944,1775417149,9df853c8
2083111586595157248,戴高乐：看我重整法国,1002.709,1775417452,9df853c8
2083136282489624576,苏联也不会帮的吧,963.227,1775420396,3c7b0ab3
2083231062217082624,一年不差。,764.612,1775431694,832ac7a1
2083247333743339520,从能统一欧洲的中原，已经衰退成了战国末的齐国。,993.642,1775433634,8f568e58
2083311194521144576,还是小看民粹主义了,1063.807,1775441247,8a98f37d
2083369322256601088,法国政府不停轮替！几乎每年一换！,876.793,1775448176,2e54a6ab
2083390453251915520,法国其实在大萧条中撑了一年多，已经很不错了,834.4,1775450695,81d933de
2083391174806764800,我嘞个自尊心，就这么把政治当儿戏啊,1067.62,1775450781,78ca2d16
