danmaku_id,content,progress,ctime,user_hash
2062014859817711872,大家别忘了，为了绿色环保我们已经降了几轮产能了，不然不可能占比只有30%出头,14.892,1772902526,be5e2f64
2063853120584468992,清代就。40%,50.403,1773121664,3e219bf
2065491802173502208,难说,208.412,1773317010,25139c54
2066661596159881728,然后机械臂大部分是进口的,188.887,1773456460,4f5bfa19
2066750427130853632,产能过剩是针对国内市场，你能外销出去的话，要的国家很多,268.168,1773467050,4f81a90d
2072605132025686528,友情提示，2025年9月28号发布的视频,35.795,1774164985,56befabe
2073388106384030720,人类历史上？工业史多少年了,42.611,1774258323,ba93e0ce
2074585111604857856,科技越发展越排斥劳动力,171.279,1774401017,7f4d8e74
2075306782502212608,还是不够，必须做好哪天跟老美真打起来，全部军工化的准备,43.561,1774487047,e505237f
2076043829006117632,工业革命一开始发生在煤最廉价的地方。挖煤的地方。而且不是机器代替人是机器代替马来抽水,63.445,1774574909,75320222
2076745347204187136,所谓@,333.699,1774658537,b3408d79
2077596788919676928,马上岗位也是机器人的了,162.761,1774760037,952a8c81
2081187780868484864,账号已注销,0.013,1775188116,320a1ade
2083327977952783360,国富论开篇的理论,102.113,1775443248,c5e78ee8
,,0.0,1775601368.3488362,
lb.c,,0.0,1775601368.3488362,
,,0.0,1775601368.3488362,
1945790940690782720,电价降了电费涨了,493.014,1759047555,1918490e
1945905390797693696,燃油车百公里油耗成本60～80元，咋算出来的？,539.177,1759061199,9d84b05
1945908305973626880,发动机不贵吗？,557.968,1759061546,1d6e970d
1945912500344096512,可控核电,431.611,1759062046,26a4bfe6
1945936069413554176,还有一个即将迎来商用的聚变能发电,513.426,1759064856,c4f63838
1945936674903348992,说世界领先都不为过,570.566,1759064928,c4f63838
1945939322582722304,问界m9増程器采购价1500，惊不惊喜,564.681,1759065244,4dc33eb3
1945972150443815168,现在纺织可是高科技产业,386.74,1759069157,6da02714
1945998383601394944,上网电价！不是你的终端价格，电网不用花钱的么？,503.967,1759072284,ff40016
1946009163306320896,这道算术题很难吗？？,548.49,1759073569,1a69dfb5
1946175202539234048,百公里油耗7油价7怎么得来60？电价是没有税费的,543.648,1759093363,e885a8e7
1946244705839488256,说到了本质,600.074,1759101648,4747a162
1948009262022756608,东北人表示电车短时间内还代替不了油车,635.35,1759312000,6f14d284
1949238168658487040,科教兴国啊,411.6,1759458497,7b8909ef
1949485317669084672,这个时候就更加需要国家的转移支付和宏观调控了，要不然财富就越来越快地集中到资本家手里了,377.151,1759487959,5fde75c3
1952158540017981696,没有降过的电价，在通货膨胀，各方便都在涨价中，不够优秀吗？,504.948,1759806632,386cc4b5
1952285523142322688,现在日常衣服真的便宜，和白送没啥区别,373.461,1759821770,9f80bde8
1952500245678783488,在部分地区早晚高峰油耗会很高，比如我表姐的408就能高达12个油,551.774,1759847367,ce3849de
1952999506015072000,综合国力已经提升上去了,460.144,1759906883,22bcc5f3
1953103422731867392,这里我会我先来，感谢马克思来源,610.498,1759919271,7a4c8244
1953949105558611968,纯电平台还真不用变速箱。新能源某个角度来说就是为了绕开传统内燃机机械体系的所有限制,587.711,1760020084,e6e29de7
1954713798414018304,前面的不要说得这么绝对，现在距离商用核聚变可能还很远，但是如果跨越了从0到1的距离，剩下的就是时间和如何提高运行稳定性及产能的问题,532.291,1760111243,43f36099
1956807984655403008,理想：这个我熟,675.629,1760360889,aeb27410
1957626465600527872,中国5000多年以来绝大部分时间都是世界TOP0，没有之一,460.753,1760458460,86ec09f2
1958043429825067776,东北用混动不香？,662.301,1760508166,df40ade7
1958620193811020032,今年固态电池就开始量产了,667.825,1760576921,c61ea76a
1959347171325474048,纯电没有内燃机，不需要油车用的润滑剂,602.572,1760663584,67153ab3
1959347696829505536,自动驾驶需要所有成员严格遵守交通法规,630.622,1760663646,67153ab3
1959612016415322880,中国的核聚变发电站正在装机,462.479,1760695156,de2bd68d
1960858769605098240,当生产技术先进了，生产劳动力就有多余,385.411,1760843780,b8336273
1961888008521709824,宁德时代2027年续航1200公里的固态电池就要量产装车了 该更新认知了 大爷,682.26,1760966475,23ad9e26
1964560842813249792,自己开车是一种乐趣,654.659,1761285102,31bf724a
1964729604921597696,当中国拥有核聚变后，工业巨兽将再次进化,436.977,1761305220,c5404c4e
1964793966515952640,那是混动车！,586.822,1761312892,30e5fdc8
1966899064431904512,现在种地都成了高科技行业了,396.958,1761563840,9b6115ad
1967969653632958976,不光是物理的问题，AI运算中心是个超级吃电大户，没有稳定可靠的大功率电源是没法正常运行的,579.261,1761691464,b22bb728
1969131304872786688,中国西部广大无人区，光资源也是遥遥领先,525.879,1761829943,bf6c5759
1969584552435616768,如果只有稀土是中国产，那我们不就只是原材料出口？做出来的产品才是真正利益最大化的啊,711.146,1761883975,51364533
1969683342337193216,新疆的电价就是两毛钱,483.194,1761895751,258e5fa5
1969685936380185856,科技才是第一 生产力,436.696,1761896061,ef96f606
1969870467679114752,这个片段是光热电站，不是光伏,476.849,1761918058,7f3a484b
1972096752341990656,感谢马圣开源,615.308,1762183452,5c4095e1
1974897787455998464,开长途确实煎熬,667.765,1762517362,f32bca56
1975869098303459584,马圣为什么只开源中文版？,625.687,1762633151,6847e7c4
1978722609252338688,还需要算整个周期花费！,534.164,1762973316,742314d1
1986555374472050944,八毛六是商住两用的电价,512.04,1763907054,3009dbac
1987119032113412864,这个就算了，可控核聚变离商用太远了,552.166,1763974248,ce8ef4a4
1987119514500517888,真要这么乐观，国内也不会建造那么多核电站，和雅鲁藏布江水利发电了,556.203,1763974305,ce8ef4a4
2016919523361917952,那个二氧化碳转淀粉的就可以实施了,561.194,1767526743,b2c37044
2041287085008878080,←对于我来说是折磨，我宁愿坐公共交通也不愿意开车，偏偏一群人按着头要你承认这是乐趣,661.49,1770431583,e6c3187a
2041472070214907904,中国的崛起不可以复制,462.227,1770453635,6785c90d
2044457604667487744,方向盘绝对不会消失，它是最基础的保障，可能会变得更小更奇怪更不利于抓握，但绝不会消失,659.298,1770809538,992c5a99
2046398278559671296,这就是三年计划，五年计划，十年计划的成果,449.019,1771040884,d3aca9dd
2046707410139215872,以后还可以用3d打印布料生产衣服吧,374.894,1771077736,971d5e8d
2046767706858221824,快堆商用了电价估计更便宜，核聚变……,563.752,1771084924,62e7117f
2047211726231184640,云南是水电第一,477.738,1771137855,75f317d9
2047470315659224832,磁气覆膜,610.213,1771168681,13d7fdec
2047884404797291520,戴森球计划,518.239,1771218044,ddbc8d24
2047891865474562816,看来选电气自动化是选对了,702.001,1771218934,e3baf4ad
2048174701208958720,全员自动驾驶还有一个很重要的优点是降低人为因素导致的车祸率和路怒症,691.668,1771252651,ac587470
2048184794205986816,也要算上电池的折损成本,526.665,1771253854,40af35bd
2048472284385466368,廉价电力是关键,442.154,1771288125,1b321a2f
2048473058989193472,国外电费早就涨了几杯了,515.796,1771288218,1b321a2f
2049422697078881536,从来都不是巧合，而是一步一步的布局和谋划,450.524,1771401423,e5994e64
2049973760056265728,别闹，机械是底层，决定了响应上限,629.357,1771467115,6258f1a0
2050174789884601856,绿点又便宜又环保，就是需要经常维修,475.142,1771491080,2e088a5f
2051544555467582976,电池得抗冻才行，不然北方冬天没法开,648.425,1771654368,18ed3ae1
2052141079432247808,氢能源智能汽车也是未来电动车的趋势,646.191,1771725480,2afe7c9b
2052142094260894720,大压铸大大减少机器人焊接工序与厂房占地面积,701.052,1771725601,2afe7c9b
2052165507259511040,错了越低端越难自动化因为没有利润，自动化手术机器人达芬奇去看看几几年造出来的,405.795,1771728392,2366f9d4
2052429493348112128,核能电池才是最好的，不过开发还需要很长时间,656.2,1771759861,17ff6f09
2052986318963006464,我去，不早说,360.846,1771826240,a8fd79a1
2052986466769951744,镇海化工！,428.131,1771826258,7ff00da4
2053208327055894784,电，核能,431.394,1771852705,a0ce0d90
2053847670745377024,吓哭了,363.016,1771928921,2bc26bab
2056020331609145600,电动化是智能化的前提这句话我非常喜欢,637.537,1772187923,33383a83
2061990039327646976,内蒙这边全是太阳能板板,469.596,1772899567,2b88a4ed
2061990437241429504,但公寓和商用电还是很贵啊,495.806,1772899615,2b88a4ed
2066755802290782208,这里拿新能源车距离是在说电便宜效率高，电池不再考虑反而，工业又不需要电池储能,529.735,1773467690,4f81a90d
2067063762023799808,那样的话会不会个人不用买车了，全用公共交通就好了,668.181,1773504402,38cc597b
2067214247779409152,遥遥领先,576.003,1773522341,847c6a18
2067215249001866752,遥遥领先,693.783,1773522461,847c6a18
2071794700259665920,真是创新推动科技发展。,423.84,1774068374,e7bf0b13
2075582043651629824,这个就没得说了，很多都是机器生产。,703.16,1774519860,e927b648
2075788906632754176,操作的也是机械,614.003,1774544520,4ba0d85f
2079602131807753728,这个扯得远了,653.208,1774999092,4c0a0fcd
2080763526792306432,怎么才三成啊,451.902,1775137541,83f265f3
2082495697664137728,初见端倪,540.292,1775344032,378251db
2082496566547744768,话多了，话多了,628.872,1775344136,378251db
,,0.0,1775601368.3488362,
lb.c,,0.0,1775601368.3488362,
,,0.0,1775601368.3488362,
1952395216262943232,huawei!,775.36,1759834846,3bc2d203
1953291298081643776,优必选,747.48,1759941667,ff76b693
1953966474129583104,太可怕了。,820.57,1760022155,d3379ac6
1955424679129348864,60%就太疯狂了！,807.154,1760195986,b8da302e
1958044563092780288,AI+机械人是加速器,797.402,1760508301,df40ade7
1961896277113594880,才45，任重道远啊,788.708,1760967461,31f9447a
1964561785054856960,未来人机大战的可能也越来越大了,729.643,1761285214,31bf724a
1968885959043080192,问题是，那为什么人类还存在么？,751.38,1761800696,65067973
1987121190275954944,ai.......,738.489,1763974505,ce8ef4a4
2048910706115557120,←机器人是机器人来维护的，也可以直接换新，不需要人类,759.66,1771340389,15f695d9
2049974845458112512,最后只有一个问题： 孩子毕业怎么找工作？,725.336,1771467244,6258f1a0
2052143674381115904,具身智能,734.165,1771725789,2afe7c9b
2052192616212781312,人类集中精力搞艺术和哲学,767.158,1771731623,36d5c4c1
2057220245646748416,Ai大模型企业跟个人用户使用的是两码事！,751.688,1772330963,1ddca47e
2066141349757132800,打不过就加入呗,814.549,1773394442,1f338321
,,0.0,1775601368.3488362,
lb.c,,0.0,1775601368.3488362,
,,0.0,1775601368.3488362,
1945864175000062976,未来咱们也会产业转移？,135.26,1759056285,fac9d39b
1945865521623012608,各种工业神殿,289.374,1759056446,93ead72
1945868051853348864,你确定这些人没进工厂？,69.347,1759056748,39dc96ee
1945872077270307840,前面的，东大有的是劳动力，但目前是缺岗位,141.011,1759057227,469570c6
1945892151452146432,欧美人不想一生都活在永无止境的流水线上,171.799,1759059620,c8ba8ed2
1945899152944670208,纺织业的黑灯工厂  以后不需要那么多人了,187.135,1759060455,1bebddc1
1945900285163867392,并非从来没有。这只是回归5000年大多数时代水平。,38.579,1759060590,66920034
1945925079121056000,机器人改变了一切,148.402,1759063546,f0d54e82
1945941288453288192,智能化,176.429,1759065478,4f5ae79e
1945947306910486784,不用交“社保”“医保”，能省很多钱,217.235,1759066195,2201f915
1945949340476824576,大英帝国可是3岁当童工，5岁进工厂的。,72.796,1759066438,eaafa579
1945950343897169664,以后就得考据星际移民来释放生产力了，先从月球基地开始,64.44,1759066557,3d9ecfca
1945954120373109504,未来低端产业向无人化转移,176.639,1759067008,b9b06b2f
1945967804717564928,不会转移了，未来不拼人口，自动化可以解决。但是初始技术和全产业链的布局就尤为重要,141.444,1759068639,eb4086fc
1945975814689162240,市场需求就那么大,58.003,1759069594,f9190c9d
1945983315840903424,玩纪元都知道产业越集中效率越高,275.869,1759070488,9ac292ad
1945984510169212928,维护保养很费的,216.013,1759070630,23e9075b
1952013433809972992,中国人第一反应 是怎么才45%,36.544,1759789334,326f4c1d
1952140527310950912,供应链的价值,284.621,1759804485,a57c2154
1952165952460366336,主要是中国人的吃苦耐劳,173.257,1759807516,834b142a
1952174714688828928,工人转型为工程师,198.298,1759808560,82d275a3
1952208312507009792,其实现在就已经过半了，只是我们按美元计价看起来占比没那么高,33.004,1759812565,9ba86f02
1952420717488731904,保守了,22.1,1759837886,464518c1
1952423853645081088,还是可能的，机械臂也有运维成本。。（doge）,208.858,1759838260,464518c1
1952440157508782592,三哥：大家看我有没有机会？,155.545,1759840204,b774ff8e
1952543945377197568,这种工业制品的配套生产能力是相当可怕的，因为它可以应用到战争模式，看我们想不想了,310.437,1759852576,9dbfb340
1953134147560784896,产业链在手，话语权就在手里,9.491,1759922934,87a9362d
1953662785833932032,自动化和自能化将锁死产业转移,151.784,1759985952,38bdac59
1953834316576709888,我国所有的战略都是建立在以后电在中国会很便宜且方便的前提下,215.355,1760006400,90b61b1f
1954286040928440064,泰勒标准管理理论,95.61,1760060250,b6b03363
1954985900413464832,是个人都知道，工业化的本质是核心科学技术。,14.277,1760143680,b762d291
1957529514809126400,使用机械臂的前提就是要有足够多的电，全球除了中国任何一个国家都不能保证24个小时供电,231.011,1760446902,d0f85066
1957930679778682112,还没达到70%就不算焊死！,21.474,1760494725,d3a3eade
1960984134038600448,前面的，机械臂要电力呀，而中国电力最发达，最便宜，电力科技最强，所以后发国家很难超越,203.541,1760858725,80db767d
1962646984447945216,这么庞大的工业产业，还不好就业，问题出在哪儿了,81.879,1761056952,17452547
1964790623185819904,这东西保养维护的人力和物料成本与老式机床相差不大，然而节省了大量操作工,202.863,1761312494,30e5fdc8
1965199383654615040,广东惠州的快递，第三天就到我们四川泸州了,346.541,1761361222,33efad39
1965406370753286656,那欧美日韩为啥不用机械臂干活？,187.014,1761385897,6992e549
1967742483602129408,←二战时代手工业还很多，特别是鞋服衣帽,51.865,1761664383,ee982a33
1968109633579598592,后面就是通过机器人的坚韧不拔和吃苦耐劳 ,157.31,1761708151,35dec193
1968920325886681600,跌升？,14.425,1761804793,7a030f7f
1969784022738096128,太少太少，不到70%啊,35.546,1761907753,3a23bd52
1974714867751682816,春秋战国时期的秦军装备制造就已经流水线操作了,126.179,1762495556,e68ac1e3
1974878311549484800,产量比产值更夸张,36.773,1762515040,f32bca56
1975024558239224064,美国巅峰时期的占比应该更高吧？,98.036,1762532474,b9a1886e
1975480390123278592,10根机械臂，需要的电费一个月也就顶一个人的工资,223.068,1762586813,e2ecc4b4
1978717915658497280,产量表现更亮眼，价格低价值少,61.16,1762972756,742314d1
1978719583213028608,中国电力煤炭资源，确实世界独一档,216.041,1762972955,742314d1
1979648845096794880,先进的生产力,75.589,1763083732,9c26ab06
1995781560418479616,便宜，卷就完事了，卷完国内卷国外,10.231,1765006901,c70c6e9a
1996681372844476672,太强了,59.946,1765114167,3a7df157
2000230084128752896,产业链、运输带来的不止是产能提升，还有成本的降低,236.35,1765537207,bd46af7b
2022485176730663168,一个关税战产业就转移了南亚地区了,284.308,1768190221,bf33e18c
2040008221116711168,工业化根本就焊不死,78.712,1770279130,b762d291
2040689212684228096,英国：为什么要刨去？,67.342,1770360311,7d9d39d8
2044939502849807104,中国是目前世界上唯一一个全产业链国家。,249.151,1770866985,1011952e
2047062997486595072,中国的工业成熟标准比发达国家底，以手机为例中国只保修一年,152.041,1771120125,d343054b
2047207026404749568,物流才是最重要的,316.047,1771137295,d6dd9bfb
2047552882756326400,显然是指同等产量的工人需求减少，这工人的分工就是最基础的降本增效，只不过你扩大产量了，对工人数量需求更多了，但并不是分工导致的工人变多，分工是可以降本增效的,136.698,1771178524,3a1b2657
2047671210708023040,自动化流水线,110.953,1771192630,f11b409a
2047883056119240192,制造业大而全的好处,249.149,1771217884,ddbc8d24
2048246589448992000,分工协作原则,96.421,1771261220,1354df4
2048318834330689024,相信后人智慧,173.403,1771269833,2ae6d315
2048319198429744640,能,206.69,1771269876,2ae6d315
2048477365583655680,维护也需要成本,196.761,1771288731,4a76a8a1
2048632475659625216,这里大家注意一下，资本更喜欢使用人力，机械是因为远超人力的效率才不得不用,203.494,1771307221,81df4bea
2049303652707284224,电不是钱啊,201.444,1771387232,27416170
2049303937299110400,工厂二十四小时转就是因为开关机器太费电,210.569,1771387266,27416170
2049515467836261120,英国也想焊死工业化，美国也想，德国更想,7.319,1771412482,93b9d839
2049550579067339776,中国的工业用电是全球最便宜而且最稳定的,255.254,1771416668,f2a32722
2049557827328436992,这是二工福特汽车发明的流水线才有的事情,89.779,1771417532,a08a6b5d
2049971375099306752,还有电力优势也是很可怕。。,321.274,1771466831,6258f1a0
2050195407061573632,不会产能过剩吗,255.41,1771493537,2fbf6ba2
2050400383368679168,中国还是低附加值的占大多数,35.502,1771517972,36f8e4d7
2050743439259872000,现在已经过剩了只是你没发现而已(っ- ‸ - ς),264.64,1771558868,954a8120
2050796639191060736,完了,186.702,1771565210,4f7ede7
2050871663821953280,才百分之三十一呀，还得努力呀,15.162,1771574153,922aaf5e
2050938592339719680,那为什么其他国家不搞机械臂,196.713,1771582132,959a87e4
2051437669980248064,才45%，没觉得高啊,58.333,1771641627,4f22d2c9
2051541809473524992,华强北的伟大,258.38,1771654041,18ed3ae1
2051645257007473408,人多但工人不多,188.128,1771666373,59abc0e7
2051658625344789760,没那么少,22.573,1771667967,2f65fdef
2051684939501882368,因为规模也扩大了。生产力大大提高。生产资料快速增长。人的数量已经跟不上生产资料的崛起数量了。一个人要管好几台机器啊！当时又没机器人。,132.909,1771671104,8bef54df
2051713778714349056,账号已注销？？,0.571,1771674541,d6e1d0f3
2052051887431768064,是动力臂，我们有救了,181.088,1771714847,d8ce12c4
2052120679344275968,以后谁来修机器，机器人修机器吗？,223.316,1771723048,f2b80599
2052137974632336128,不一定没发生过,42.808,1771725110,b9df91d4
2052504023202014720,吓哭了,308.483,1771768746,4cd9cf6d
2052537530909854976,宅兹中国！,27.03,1771772740,d8209069
2052984318045025280,哈哈哈哈,180.376,1771826002,a8fd79a1
2052985326917850624,卡兄卡弟万岁,315.273,1771826122,7ff00da4
2053060992807907072,工业总量会越来越大，需要的人也就越来越多，从几十万到几百万，然后上千万，最后是亿，几亿。没有人口支撑，你的工业是发展不起来的,132.019,1771835142,e05023fe
2053061339668375552,工业品需要被消费掉，其他国家有这个市场吗？,156.099,1771835183,e05023fe
2053150331826777856,深圳的快递，如果快的话，中通两天到河北,356.111,1771845792,ec7f028d
2053294614819564544,二战后美国的工业占了40%,42.125,1771862992,45cb3b1a
2053323015987063296,维护也是大头,198.255,1771866377,a57191fa
2053323556850892800,全工业门类的厉害之处,242.631,1771866442,a57191fa
2053717048441852672,不用刨去,69.561,1771913350,ca5c8202
2053724624184786432,德日用机械臂，成本也中国高,195.643,1771914253,bc7c4d30
2053900082759344896,前面的红色字幕，有这理，但是具体在现在而不是以前,15.12,1771935169,15d7bd2d
2054235659845704960,第二次工业革命是电！！,102.889,1771975173,c9924f36
2054449660097763584,亚当斯密的《国富论》最核心的观点——分工,122.477,1772000684,2e350377
2054738810508187648,明朝宋朝几乎占世界一半多了最高70%,28.148,1772035153,662a700b
2054739239845260288,以前的作坊占世界70%,50.349,1772035204,662a700b
2055157085486387456,放心，五矿会出手，噢，还有保变电气,1.0,1772085016,8eba7d52
2055169537611670016,人个体功能退化和整体效率提升，是一对此消彼长的关系,105.448,1772086500,4c53f55
2055174235785418240,幽灵视频？,0.515,1772087060,9cfb8b50
2055201589048370432,ai时代赛博朋克社会，不需要10亿级人口，只需要百万级工程师就能维持世界霸权,164.34,1772090321,c57e5141
2055309510259694336,曾经经济产值也到过全球的一半,51.836,1772103186,d5446d56
2055322797571865344,福特：我也这么想的,90.003,1772104770,757aea10
2055925959802640384,《账号已注销》,0.0,1772176673,4e21f825
2055926226753387008,等一下主页怎么进不去,5.933,1772176704,4e21f825
2056075505522141184,别忘了还有稳定的电能,350.846,1772194500,41ca2aa5
2056679212618388480,错了，英国孩子也参与工作(通烟囱),67.96,1772266467,fdc78554
2058210106566656512,中国的钢铁产量超过了全球其他国家的总和（2022年数据）,70.26,1772448964,bc499910
2058244401184110080,英国：为啥要刨去啊？,79.402,1772453052,bcd8c8ab
2058821785558027776,其实是程序员的坚韧不拔和吃苦耐劳,159.144,1772521882,b5a3830
2059076300815419904,为什么要抛去？,68.018,1772552222,339281f0
2059642847745227776,成都的电话客服集群,282.069,1772619760,e45d2264
2061869929132587008,是不是旁边还有一个炼钢厂,264.972,1772885249,6924ed3a
2061879320196754944,那是高新技术吧↑,162.835,1772886368,4365a315
2062014859817711872,大家别忘了，为了绿色环保我们已经降了几轮产能了，不然不可能占比只有30%出头,14.892,1772902526,be5e2f64
2063853120584468992,清代就。40%,50.403,1773121664,3e219bf
2065491802173502208,难说,208.412,1773317010,25139c54
2066661596159881728,然后机械臂大部分是进口的,188.887,1773456460,4f5bfa19
2066750427130853632,产能过剩是针对国内市场，你能外销出去的话，要的国家很多,268.168,1773467050,4f81a90d
2072605132025686528,友情提示，2025年9月28号发布的视频,35.795,1774164985,56befabe
2073388106384030720,人类历史上？工业史多少年了,42.611,1774258323,ba93e0ce
2074585111604857856,科技越发展越排斥劳动力,171.279,1774401017,7f4d8e74
2075306782502212608,还是不够，必须做好哪天跟老美真打起来，全部军工化的准备,43.561,1774487047,e505237f
2076043829006117632,工业革命一开始发生在煤最廉价的地方。挖煤的地方。而且不是机器代替人是机器代替马来抽水,63.445,1774574909,75320222
2076745347204187136,所谓@,333.699,1774658537,b3408d79
2077596788919676928,马上岗位也是机器人的了,162.761,1774760037,952a8c81
2081187780868484864,账号已注销,0.013,1775188116,320a1ade
2083327977952783360,国富论开篇的理论,102.113,1775443248,c5e78ee8
,,0.0,1775601368.3488362,
lb.c,,0.0,1775601368.3488362,
,,0.0,1775601368.3488362,
1945790940690782720,电价降了电费涨了,493.014,1759047555,1918490e
1945905390797693696,燃油车百公里油耗成本60～80元，咋算出来的？,539.177,1759061199,9d84b05
1945908305973626880,发动机不贵吗？,557.968,1759061546,1d6e970d
1945912500344096512,可控核电,431.611,1759062046,26a4bfe6
1945936069413554176,还有一个即将迎来商用的聚变能发电,513.426,1759064856,c4f63838
1945936674903348992,说世界领先都不为过,570.566,1759064928,c4f63838
1945939322582722304,问界m9増程器采购价1500，惊不惊喜,564.681,1759065244,4dc33eb3
1945972150443815168,现在纺织可是高科技产业,386.74,1759069157,6da02714
1945998383601394944,上网电价！不是你的终端价格，电网不用花钱的么？,503.967,1759072284,ff40016
1946009163306320896,这道算术题很难吗？？,548.49,1759073569,1a69dfb5
1946175202539234048,百公里油耗7油价7怎么得来60？电价是没有税费的,543.648,1759093363,e885a8e7
1946244705839488256,说到了本质,600.074,1759101648,4747a162
1948009262022756608,东北人表示电车短时间内还代替不了油车,635.35,1759312000,6f14d284
1949238168658487040,科教兴国啊,411.6,1759458497,7b8909ef
1949485317669084672,这个时候就更加需要国家的转移支付和宏观调控了，要不然财富就越来越快地集中到资本家手里了,377.151,1759487959,5fde75c3
1952158540017981696,没有降过的电价，在通货膨胀，各方便都在涨价中，不够优秀吗？,504.948,1759806632,386cc4b5
